### ISSUE TITLE
Broker Disconnect After CONNECT Request

### ISSUE THREAD

**Issue by pascaldekloe** [hivemq/hivemq-community-edition#256]
## Expected behavior

The broker must respond to incoming CONNECT requests when listening on a TCP port.

## Actual behavior

The broker closes the connection after receiving a CONNECT request during startup shortly.

### Steps

(1) Download client from <https://gobinaries.com/pascaldekloe/mqtt/cmd/mqttc>.
(2) Start broker with something like `docker run -d -p 1883:1883 hivemq/hivemq4:4.4.4`.
(3) Run `mqttc localhost` quickly after (2).

The error printed is `mqtt: broker closed the connection (EOF); CONNECT not confirmed`. Wireshark confirms connection loss after request submission.

**Comment by pascaldekloe** [comment]
See https://github.com/emqx/emqx/issues/4360#issuecomment-801882719 for a netcat reproduction alternative.

**Comment by DC2-DanielKrueger** [comment]
Hallo pascaldekloe,

Did you confirm that the server has opened the port before you send the connect to it? In the linked issue at EMQ it does not look that way. 

Best regards, 

Daniel

**Comment by pascaldekloe** [comment]
No waiting for completion. It just connects to the TCP socket as soon as it is available. See the EMQ X issue for a WireShark screenshot.

**Comment by DC2-DanielKrueger** [comment]
So at EMQ X you saw that the TCP flow was:
```
Client -> syn -> Broker
Broker -> syn ack -> Client // tcp is established
```

Tried this with the HiveMQ CE without docker and got:
 ```
70	31.622444	127.0.0.1	127.0.0.1	TCP	68	49672 → 1883 [SYN] Seq=0 Win=65535 Len=0 
71	31.622461	127.0.0.1	127.0.0.1	TCP	44	1883 → 49672 [RST, ACK] Seq=1 Ack=1 Win=0 Len=0
```

So the TCP could not be established. I wonder, if the docker networking might allow you to establish a TCP connection, but then closes it. Can you verify the package flow at your setup? It makes a great difference whether you get a SYN, ACK or RST, ACK. The later is expected, because the this will happen if the port is not open yet. If we send a SYN, ACK, we should handle the connect message.

**Comment by DC2-DanielKrueger** [comment]
Ok, seems that this is docker. I just run: 

 docker run -d -p 1885:1885 hivemq/hivemq4:4.4.4 
```
 to map the port to 1885 (unused in the docker container) and got the following:
 
 3126	1029.992190	127.0.0.1	127.0.0.1	TCP	68	49918 → 1885 [SYN] Seq=0 Win=65535 
 3127	1029.992279	127.0.0.1	127.0.0.1	TCP	68	1885 → 49918 [SYN, ACK] Seq=0 Ack=1 Win=65535 
```
 there is nothing listening on that port (i repeated the test with port = 40 000). Seems like docker will allow to establish the TCP connection anyway, even if nothing is listening on the port.

**Comment by pascaldekloe** [comment]
Containers probably listen to the configured ports from the start for simplicity. Otherwise, the host TCP stack would need to be aware of the container state. So maybe the [other brokers](https://github.com/pascaldekloe/mqtt/wiki/Brokers) just start fast enough to prevent the container from dropping connections?

Fast startups is not Java's strong-suite. 😅 Perhaps this is not so much of an issue for people with liveness checks in place. The documentation should clearly state how though, unless I'm missing something obvious, like a convention or so? Maybe I'll try to get Java to listen to a port with a simple echo service, and see whether the startup makes it in time before packet loss.

**Comment by DC2-DanielKrueger** [comment]
Yeah, startup time are about 5 seconds, other brokers may be faster (no class loading, no JIT, no file persistence).
 I´ll close this issue, feel free to open an issue for a readiness probe for the docker image - could be useful. 

Best regards, 

Daniel

**Comment by pascaldekloe** [comment]
The issue is not closed @DC2-DanielKrueger. The readiness probe could be a workaround, but, again, it needs to be clear how.
